{
  "source_digest": "sha256:02119f16b32e849d923420c8b76ec53aec85ca1a1ef635803812c171f475c844",
  "currency_code": "USD",
  "coverage": "declared_complete",
  "selected_draws": [
    {
      "variant": null,
      "account_id": "property-capital",
      "period_id": "jan",
      "movement_id": "draw-1"
    }
  ],
  "expenditures": [
    {
      "expenditure_id": "expense-1",
      "ref": {
        "section": "cash_flow_series",
        "variant": "gross",
        "row_index": 0
      },
      "category": "other_capex",
      "gross": true,
      "currency_code": "USD",
      "funded_amount": 100,
      "source": {
        "document": "synthetic-reserve-and-invoices.pdf",
        "locator": "Invoice 1: separately stated gross capital work; explicit reserve-funded share 100"
      }
    }
  ],
  "bindings": [
    {
      "draw": {
        "variant": null,
        "account_id": "property-capital",
        "period_id": "jan",
        "movement_id": "draw-1"
      },
      "expenditure_id": "expense-1",
      "funded_amount": 100
    },
    {
      "draw": {
        "variant": null,
        "account_id": "property-capital",
        "period_id": "jan",
        "movement_id": "draw-1"
      },
      "expenditure_id": "expense-1",
      "funded_amount": 100
    }
  ]
}
